종목코드,회사명,업종,기업개요,시가총액,마켓타입
034120,SBS,텔레비전 방송업,"1990년 11월 14일자로 설립되어 방송사업 및 문화서비스업, 광고사업 등을 영위하고 있음. 동사의 주요 사업은 지상파를 근간으로 하는 콘텐츠 제작, 지상파 플랫폼 광고 사업과 콘텐츠 유통사업임. 광고사업은 TV, 라디오 광고와 협찬으로 구성되어 있고, 프로그램 판매 등의 콘텐츠유통사업은 고퀄리티의 지상파 콘텐츠를 해외 및 국내 OTT, IPTV, 케이블TV, 위성방송 등에 판매하고 있음.",2809,KOSPI
005090,SGC에너지,전기업,"동사 및 종속회사의 사업부문은 '발전/에너지', '건설 및 부동산', '유리', '기타' 등으로 이루어져 있음. 발전/에너지 부문은 열병합발전을 통해 증기와 전기를 동시에 생산하며 증기는 현재 20개의 증기 수요처에 공정용 증기를 공급하고 있으며, 전기는 자체 사용 후 모두 전력거래소에 역송하여 계통한계가격(SMP)으로 판매. 건설 및 부동산 부문에서는 플랜트, 토건, 터미널 사업을 영위하고 있음.",3667,KOSPI
004060,SG세계물산,상품 종합 도매업,"동사의 연결회사 사업부문은 의류수출, 패션사업, 기타부문으로 구성되어 있음. 의류수출 사업은 GAP그룹(GAP,BANANA REPUBLIC), MACY'S 등 주로 미국 대형 바이어에 주문자 상표부착방식(OEM)으로 제품을 공급하고 있음. 패션사업 부문은 남성정장 바쏘, 바쏘옴므, 여성복 ab.f.z(에이비에프지), ab.plus(에이비플러스), 명품 피혁류 COLOMBO(콜롬보) 총 5개의 브랜드를 보유함.",688,KOSPI
001770,SHD,1차 철강 제조업,"1956년 설립된 동사는 표면처리강의 제조, 임가공, 각종철판의 생산가공 및 판매업, 수출입업, 임대업을 주요 사업으로 영위함. 석도강판의 제조기술을 해외에서 인정을 받아 PLANT수출을 중국에 2차례 한 바 있으며 신규시설투자의 증가로 인하여 매년 생산능력이 증가하고 있음. 해외에서도 인정받은 전기주석 도금강판의 제조업레초서 오랜 기간의 경험을 토대로 해외시장의 입지를 넓히고 있음.",195,KOSPI
009160,SIMPAC,1차 철강 제조업,"동사는 프레스사업부, 합금철사업부, Roll사업부, 트레이딩, 산업기계, 위생관리서비스, 임대 및 기타 사업부문을 영위. SIMPAC 인더스트리는 주물사업 부문을 물적분할하여 신설회사 SIMPAC 주물을 설립하고 설립회사의 주식 100%를 소유함. SIMPAC METAL과의 합병으로 인하여 합금철 사업부, Roll 사업부가 동사의 사업부로 편입됨. 연결실체의 지배기업인 심팩홀딩스로부터 지분 100%를 취득함.",2490,KOSPI
011790,SKC,기타 화학제품 제조업,"리튬이온 2차전지 소재인 전지박(Copper Foil) 등 제품을 생산, 판매하는 2차전지 소재사업, PO 등을 생산, 판매하는 화학사업을 영위함. 반도체테스트용 실리콘러버소켓, CMP Pad 등을 생산, 판매하는 반도체 소재/부품 사업 또한 영위함. 반도체소재사업부분은 반도체 IC와 IT 디바이스등을 테스트하는 반도체테스트소켓과 반도체테스트 장비에 사용되는 인터페이스 유닛, 커넥터 등을 생산, 판매.",39913,KOSPI
011420,갤럭시아에스엠,스포츠 서비스업,"동사는 스포츠마케팅과 국내판권을 소유하여 운동기구 유통사업을 영위하고 있음. 스포츠단체들과 지역 단체들이 주최하는 스포츠대회마케팅, 스폰서십, 머천다이징 등 활발한 스포츠 마케팅사업을 추진하고 있음. 선수 매니지먼트사업은 다양한 경기 및 대회 개발을 포함하여 방송 및 스폰서십을 연계하는 토털 매니지먼트를 추구, 유통사업은 이탈리아 명품운동기구인 테크노짐의 국내총판권을 소유하여, 신규사업으로 공급하고 있음.",565,KOSPI
267290,경동도시가스,연료용 가스 제조 및 배관공급업,"울산광역시 및 양산시(경상남도) 일대를 공급권역으로 하여 한국가스공사로부터 공급받아 도시가스배관을 통해 최종 소비자에게 공급하고 있음. 한국가스안전공사에서 실시하는 안전관리수준평가(QMA)에서 2009년부터 15년 연속 최우수 등급을 달성 및 도시가스 업계 최초로 울산지역 최초의 소비자중심경영(CCM)인증 기업임. 2018년 배관임대사업을 개시하였고, 2021년 상반기 수소충전소를 통해 차량용 수소공급을 시작하였음.",1084,KOSPI
214390,경보제약,기초 의약물질 제조업,"종근당 그룹의 계열사로 1987년 3월 설립되어 2007년 경보제약으로 사명 변경하였으며, 원료의약품과 완제의약품을 주요 사업으로 영위. 순환기 약물과 흡입마취제 등 전문의약품과 다양한 일반의약품도 시판하며 의료기기, 동물의약품 및 영양제 등 동물건강분야 사업도 활발하게 전개중임. 2019년도부터는 의료기기 사업을 추가하여 사업성을 다각화하는 등 수익성을 증대할 수 있는 분야의 개척을 위해 노력하고 있음.",1779,KOSPI
017900,광전자,반도체 제조업,"반도체 및 전자부품의 제조 및 판매를 주된 목적으로 1984년 7월 31일 코리아테크노(주) 상호로 설립된 후 광전자(주)로 상호가 변경되었음. 전자부품 제조 업체로 Discrete 반도체, 광센서, LED 등에 들어가는 전자부품을 제조, 판매함. 주력 사업 분야의 고유 기능 및 발전을 통해, 5G와 사물인터넷(IoT), AI, 빅데이터, 자율주행 등과 결합하며 신시장 창출을 위한 기반을 마련하고 있음.",995,KOSPI
002720,국제약품,의약품 제조업,"동사는 1959년 설립되어 1975년 유가증권시장에 상장하였으며, 케이제이케어를 포함한 5개의 계열사를 가지고 있음. 의약품 제조 및 판매업을 영위하는 법인으로서, 대표적으로 큐알론점안액, 레티움정, 에제로바정, 콜렌시아연질캡슐, 국제세파제돈주 등 일반의약품 및 전문의약품 등을 취급함. 전국 각 지점 영업사원들의 영업활동을 통해 약국, 의원, 병원, 도매상 등의 거래처에 제품을 판매하고 있음.",1225,KOSPI
011780,금호석유화학,기초 화학물질 제조업,"동사 및 종속회사는 합성고무, 합성수지, 정밀화학, CNT, 건자재, 에너지 사업 및 페놀유도체 제조, 특수합성고무, 항만운영, 리조트 운영 등의 사업을 영위하고 있음. 합성고무 제품에는 SBR, BR, NBR, LATEX 등이 있으며 합성수지 제품에는 PS, ABS, EPS, PPG 등이 있고 정밀화학 제품에는 노화방지제, 가황촉진제 등이 있음. 기타 사업부문 품목으로는 CNT, 스팀, 임대료 등이 있음.",29357,KOSPI
073240,금호타이어,고무제품 제조업,"동사는 2003년 금호산업 타이어산업부의 자산부채 현물출자 및 영업양수도를 통해 설립되었음. 한국, 중국, 미국, 베트남에 위치한 8개 타이어 생산공장을 토대로 글로벌 생산체계를 구축하고, 전세계 판매 네트워크를 갖춘 타이어 제조, 판매 기업임. 해외10개 판매법인과 13개 해외지사/사무소에서 글로벌 타이어 판매를 담당하고 있으며, 한국, 중국, 미국, 독일의 4개 지역에 R&D센터를 운영하고 있음.",12754,KOSPI
024110,기업은행,은행 및 저축기관,"1961년 중소기업자에 대한 효율적인 신용제도를 확립함으로써 자주적인 경제활동을 지원하는 것을 목적으로 설립된 중소기업대출 특화 전문은행임. 60년 넘게 축적된 중기금융 노하우와 정교한 신용평가시스템을 바탕으로 우량 기업 발굴 및 지원하며, 체계적인 리스크 관리 중임. 연결대상 주요종속기업은 IBK자산운용, IBK투자증권, IBK캐피탈 등임. 전국에 600여 개의 지점과 중국, 인도네시아, 미얀마에 현지법인을 두고 있음.",114670,KOSPI
092790,넥스틸,1차 철강 제조업,"동사는 2023년 8월 유가증권시장에 상장하였으며, 강관의 생산과 판매를 주요사업으로 영위하고 있음. 주요 제품은 유정 굴착 및 채유에 사용되는 OCTG와 송유관, 배관용 강관, 구조용 강관 등으로 구성되어 있음. 글로벌 종합강관 업체를 목표로 국내유일, 아시아 최대 외경인 전기저항용접 강관(ERW) 26인치 설비 구축, 신재생 및 풍력 에너지 등에 사용되는 초대구경 강관 설비 구축 등에 투자를 진행하고 있음.",2842,KOSPI
251270,넷마블,소프트웨어 개발 및 공급업,"동사의 연결실체는 모바일 게임 개발 및 퍼블리싱 사업을 영위하며 넷마블㈜는 게임 개발 자회사가 개발한 게임 등을 퍼블리싱하는 사업을 전문적으로 영위. 동사의 연결실체가 개발하여 공급하는 게임의 주요 라인업으로는 '마블 콘테스트 오브 챔피언스', '잭팟월드' ,'세븐나이츠', '몬스터길들이기' 등이 있음. MMORPG부터 캐쥬얼 장르까지 라인업을 갖추었으며, 구글플레이, 애플앱스토어 등 마켓에서 높은 순위를 보이는 게임을 보유함.",41172,KOSPI
117580,대성에너지,연료용 가스 제조 및 배관공급업,"2009년 10월 대성홀딩스로부터 물적분할하여 설립, 2010년 12월 24일에 한국거래소 유가증권시장에 상장함. 한국가스공사로부터 천연가스를 공급받아 취사용, 난방용, 냉난방공조용, 영업용 및 산업용 도시가스를 공급함. 시내버스용 연료공급을 위한 천연가스충전소를 12개소 운영하고 있으며, 대구광역시 죽곡지구에 열과 전기를 공급하는 열병합발전소를 운영하고 있음.",2514,KOSPI
145720,덴티움,의료용 기기 제조업,"동사는 2000년 설립되어 임플란트 제품을 주력으로 치과용 의료기기 및 생체재료를 Total Solution으로 개발, 생산, 판매하고 있음. 임플란트 전체 치료 과정 Package 판매 확대를 통해 매출 성장과 수익성을 확대해 나가고 있음. 동남아시아 등 해외시장에 적극적인 투자를 통한 성장동력 확보와 유통경로 다각화, 영업력 강화를 통해 지속적인 성장과 높은 수익성을 달성할 계획임.",6431,KOSPI
460850,동국씨엠,1차 철강 제조업,"동사는 2023년 6월 동국제강의 냉연사업부문이 인적분할되어 신설된 기업임. 최고 수준의 도금 기술력을 바탕으로 가전, 건축 등 우수한 내식성이 필요한 도금강판을 생산하고 있고, 세계 최대 규모의 컬러강판 생산 능력과 프리미엄 제품력을 바탕으로 컬러강판 시장 선도 중. 냉연사업은 Hot Coil을 주 원재료로 하여 냉연강판, 도금강판, 컬러강판을 생산함. 전방산업의 선별적 업황 여부 및 후방산업인 철강산업과 밀접한 영향이 있음.",1863,KOSPI
002210,동성제약,의약품 제조업,"동사는 1957년 설립되어 의약품, 화장품의 총 2개 사업부문으로 운영되고 있으며, 1990년 유가증권시장에 상장함. 의약품과 화장품 중 염모제 제품군은 대부분 아산공장에서 직접 생산 중이며, 그 외 제품군은 상품을 매입하여 판매하는 체제로 운영하고 있음. 광역학치료를 통한 암 치료시장 진입을 위한 연구개발을 강화하는 한편, 일반의약품, 건강기능식품, 의료기기 및 헬스케어 관련서비스 산업으로 사업을 다각화하고 있음.",1168,KOSPI
014820,동원시스템즈,플라스틱제품 제조업,"동사는 종합패키징 및 첨단소재전문기업으로서 연포장재, 알루미늄박, 성형용기, 식품, 음료용 CAN, E.O.E, 페트병, 유리병, 이차전지 소재 등을 제조하여 판매. 포장재의 경우 품질경영시스템을 통해 축적된 노하우를 바탕으로 북미, 남미, 유럽, 동남아시아 등 세계 전역으로 수출하고 있음. 이차전지 소재의 경우 이차전지 원형캔과 양극박 등을 중심으로 대량생산 체제를 구축하고 국내 공급라인 구축에 박차를 가함.",12684,KOSPI
092200,디아이씨,자동차 신품 부품 제조업,"동사는 자동차부품, 중장비(지게차, 굴삭기)부품, MOTORCYCLE 부품 등을 제조, 판매. 설립 초기 농기계부품을 주로 생산하였으나 연구개발과 다년간 축적된 기술을 바탕으로 생산품목을 자동차부품, 중장비부품, Motorcycle부품 분야로 점차 확대하며 국내 최고의 Gear Maker로 성장. 대표적 수출품인 Motorcycle용 고성능 Engine 및 Transmission은 대량 생산 체제를 갖추고 있음.",1651,KOSPI
013570,디와이,기타 금융업,"동사는 투자사업 등을 주 사업목적으로 하고 있으며 2024년 1분기 기준, 국내 6개 종속기업과 미국 등 9개의 해외종속기업을 두고 있음. 2014년 12월,  투자사업 등을 영위하는 디와이 주식회사와 유압기계사업을 영위하는 디와이파워 주식회사, 자동차부품사업을 영위하는 디와이오토 주식회사로 각각 분할되었음. 디와이 주식회사는 경영자문 및 컨설팅, 지주사업을 주요 사업으로 함.",1148,KOSPI
032350,롯데관광개발,여행사 및 기타 여행보조 서비스업,"1971년도에 설립된 여행전문업체로 관광개발 및 국내외 여행알선업, 항공권 판매대행업, 전세 운수업을 주요 사업으로 영위해온 대한민국 대표 종합여행기업임. 2020년 12월 18일 제주 드림타워 복합리조트가 오픈하면서 당사의 사업 포트폴리오는 호텔과 리테일까지 확장됨. 현재는 2개 사업부(여행사업부, 재경부), 20개 팀으로 구성되어 있으며, 전국 대리점 및 여행사들과의 업무 협력을 통한 판매망 확보함.",6675,KOSPI
020150,롯데에너지머티리얼즈,전자부품 제조업,"동사의 사업은 소재부문과 건설부문로 구분되며, 동사를 포함하여 소재부문 산하 8개, 건설부문 산하 8개 종속기업으로 구성되어 있음. 소재부문은 핵심기술을 바탕으로  2차전지 핵심소재인 Elecfoil  제조 및 판매를 주요 사업으로 영위하고 있음. 건설부문은 건축물 외장공사(유리 및 창호 공사), 건축 등 다양한 관련 사업 분야를 영위하고 있으며, 주요 사업장소는 국내외 다양한 건축현장 등임.",12634,KOSPI
071840,롯데하이마트,가전제품 및 정보통신장비 소매업,"1987년 6월 하이마트로 설립된 동사는 가전제품 도소매업을 영위하며, 2024년 반기말 기준 329개의 직영 점포와 11개의 물류센터를 운영 중임, 최대주주는 2008년 유진기업으로 변경된 후 2012년 10월 롯데쇼핑으로 다시 바뀌었으며, 상호도 롯데하이마트로 변경함. 주요 판매 제품은 백색 및 생활/주방가전, 영상 및 IT가전이며 매출 구성비는 2023년 기준 백색 및 생활/주방가전이 66%, 영상 및 IT가전이 34%임.",1808,KOSPI
009680,모토닉,자동차 신품 부품 제조업,"동사는 자동차 부품의 매출액과 자산 총액이 전체 부분의 90%를 초과하는 단일 사업부문으로 운영됨. 1974년 3월 자동차 부품인 캬뷰레타 및 Diecasting을 생산할 목적으로 설립되었고 그후 생산제품이 LPI System, OPU, FCEV(수소전기차) 부품 등으로 다양화 됨. 대구와 성주에 각각 1개의 공장을 운영하고 있으며 해외종속기업인 모토닉인디아는 인도에 소재하고 있음.",2864,KOSPI
396690,미래에셋글로벌리츠,부동산 임대 및 공급업,정보 없음,1022,KOSPI
035150,백산,플라스틱제품 제조업,"폴리우레탄 합성수지와 부직포 등의 기포제를 사용하여 합성피혁을 제조해 판매하는 것이 주요 사업임. 인도네시아, 중국, 베트남에 현지 법인과 생산라인을 보유함. 스포츠 신발, 전자제품 내장제, 차량 내장제 등이 주요 사업 분야임. NIKE, ADIDAS, REEBOK 등 국제적으로 인지도가 높은 회사에 대한 공급이 매출액의 80% 이상을 차지함. 합성피혁 부문에서 BRAND 시장점유율 25%를 차지할 정도로 꾸준히 성장하고 있음.",2722,KOSPI
005030,부산주공,자동차 신품 부품 제조업,"1967년 4월 자동차부품 제조 및 가공업을 주사업목적으로 설립되었으며, 1975년 유가증권시장에 상장함. 동사는 제철, 제강, 특수강, 주물업 및 압연과 기계공업, 자동차부품제조 및 가공업, 금속기계가공업, 수출입업, 부동산임대업 등을 주요 사업으로 영위하고 있음. 동사는 완성부품의 매출 비중을 높이기 위하여 가공설비의 확충 및 신기술 개발에 주력하고 있음.",383,KOSPI
008040,사조동아원,"곡물가공품, 전분 및 전분제품 제조업","배합사료 제조 및 판매사업을 영위할 목적으로 1972년 7월에 설립되었으며, 1989년 6월에 주식을 증권거래소에 상장함. 2017년 8월 최대주주인 한국제분주식회사를, 2018년 7월 종속회사인 한국산업주식회사를 각각 흡수합병하였음. 원맥을 수입 ·가공하여 판매하는 제분사업부문과 가축 및 양식어류의 사료를 제조 ·판매하는 생물자원사업부문을 주요사업으로 영위하고 있음.",1434,KOSPI
028050,삼성E&A,"건축기술, 엔지니어링 및 관련 기술 서비스업","코리아엔지니어링으로 설립되어, 1991년에 삼성엔지니어링으로 상호를 변경함. 2024년 3월 21일에 삼성이앤에이로 상호를 변경하였음. 동사는 플랜트 건설 및 산업기계 제작판매 공학, 기술서비스, 토건, 환경오염 방지시설, 가스시공, 에너지진단, 환경영향평가, 폐기물처리 등을 영위하는 회사임. 사업부문은 화공(오일&가스 프로세싱, 정유, 석유화학, 그린솔루션)과 비화공(산업설비, 환경, 바이오)으로 구분하고 있음.",34712,KOSPI
006400,삼성SDI,일차전지 및 이차전지 제조업,"동사는 중ㆍ대형전지, 소형전지 등의 리튬이온 2차 전지를 생산/판매하는 에너지솔루션 사업부문과 반도체 및 디스플레이 소재 등을 생산/판매하는 전자재료 사업부문을 영위함. 자동차용 중형전지는 고효율, 고용량 리튬이온 2차전지를 개발하고 이를 자동차 완성업체에 공급함. 소형전지는 원형, 파우치 등의 제품을 개발 및 판매하고 있으며 이는  스마트폰, Note PC, 전동공구 등의  휴대 제품 뿐만 아니라 자동차용 전지에도 사용됨.",180507,KOSPI
207940,삼성바이오로직스,기초 의약물질 제조업,"삼성그룹의 계열사로 2011년 4월 설립되었으며, 국내외 제약회사의 첨단 바이오의약품을 위탁 생산하는 CMO 사업을 영위. 2018년 cGMP 생산을 시작하여 2019년말 기준 36.2만리터 생산설비를 가동 중이며, 이 시장에서 선발업체를 추월해 생산설비 기준 세계 1위 CMO로 도약. 동사의 바이오의약품 연구개발 자회사인 삼성바이오에피스와 아키젠바이오텍은 바이오시밀러 개발 및 상업화를 진행 중.",651954,KOSPI
006110,삼아알미늄,1차 비철금속 제조업,"동사는 알루미늄박 국산화 실현이라는 가치를 걸고 1969년 설립한 이래 알루미늄박과 각종 레토르트 파우치 및 의약품, 산업용 등의 가공용 제품을 생산, 판매하고 있음. 최근에는 2차전지 시장이 급성장함에 따라 당사가 선도적으로 개발해 온 LIB 양극집전체 판매 확대가 회사 성장을 이끌고 있음. 연결회사는 압연, 가공, 전자부품판매 사업부문의 총 3개 사업부 체제로 운영되고 있음.",5811,KOSPI
004380,삼익THK,일반 목적용 기계 제조업,"동사는 수공용 줄을 생산, 판매할 목적으로 1965년 설립되었으며, 이후 기타 기계 및 장비제품의 제조 및 판매 업종을 추가함. 산업설비자동화, 반도체 제조장비 및 시험장비 등에 필수요소 부품인 LM시스템과 LM가이드, 볼스크류, 서브모터, 감속기 등을 조합한 메카트로시스템 사업을 영위함. 동사는 주력품목인 LM시스템의 각종 적용 기술을 별도 기술 지원 홈페이지를 통하여 자료를 구축 및 고객 지원을 하고 있음.",1827,KOSPI
002450,삼익악기,악기 제조업,"동사 악기사업의 주요 제품 품목 군은 피아노, 기타, 현악기, 일반악기로 구성됨. 피아노는 업라이트피아노와 그랜드피아노, 기타 및 현악기는 전기기타, 바이올린, 첼로, 일반악기는 플룻, 섹소폰 등을 판매. 전자악기는 신디사이져, 레코딩 장비를 판매 중이며, 관현악기는 바이올린, 첼로 색소폰 등을 판매하고 있음. 피아노 및 일반악기와 수입상품 판매를 주요사업으로 하며 부동산임대, 태양광사업으로 사업영역 확장함.",1002,KOSPI
009470,삼화전기,전자부품 제조업,"동사는 1973년 삼화니찌콘 주식회사로 설립되어 1974년 삼화전기 주식회사로 사명을 변경하였으며 콘덴서의 제조 및 판매를 주 사업으로 하고 있음. 제품의 특성별로 전해콘덴서, 전기이중층콘덴서, 칩전해콘덴서, 하이브리드콘덴서 등 제품군으로 구별하고 있음. 종속회사인 삼화텍콤은 인도네시아 현지공장인 PT.SAMWHA INDONESIA(보유지분 100%)를 설립하여 트랜스포머, 파워인덕터 등의 제품을 생산함.",2027,KOSPI
204210,스타에스엠리츠,부동산 임대 및 공급업,정보 없음,225,KOSPI
134790,시디즈,가구 제조업,"동사는 2010년 12월 15일에 설립되었으며 의자가구 제조업을 주요 사업으로 영위하고 있음. 생산된 주요 제품 등은 대리점, 백화점, 대형마트, 온라인쇼핑몰, 에이전트 등의 판매 경로를 통하여 국내외로 판매되고 있음. 현재 국내 의자 시장 점유율 및 브랜드 인지도 1위의 기업으로 자리잡았으며, 디자인과 기술력으로 차별화된 제품을 국내 의자 시장에 지속적으로 선보이고 있음.",482,KOSPI
102280,쌍방울,봉제의복 제조업,"(주)티이씨앤코로부터 2008년 4월에 인적분할하여 설립된 분할신설회사임. 동사의 사업영역은 크게 제조, 도소매업으로 나눌 수 있음. 제조업으로는 국내의재단 수주 가공 사업을 영위하고 있고, 도소매업으로는 내의류를 주력 중심으로 국내외 사업을 영위함. 1987년, 자체 브랜드인 트라이(TRY)를 런칭. 중국 길리에 길림트라이방직 유항공사 외 2개의 현지 생산법인 및 중국 북경과,상해,심양에 판매 법인 두고 있음",706,KOSPI
004920,씨아이테크,영상 및 음향기기 제조업,"동사는 2015년 3월 키오스크의 개발, 제조 및 판매업을 주된 사업으로 하는 씨아이테크를 흡수합병함에 따라 2015년 4월에 상호를 삼영홀딩스에서 씨아이테크로 변경하였음. 동사의 주사업부문은 IT와 유통 및 부동산으로 구성되어 있음. 특히 IT사업부문은 자동증명발급기, 티켓발권기, 디지탈 광고 KIOSK, 디지탈 안내 KIOSK , 하이파이 오디오, 통신미디어 제품 등을 제조, 판매하는사업을 활발하게 전개중임.",650,KOSPI
020560,아시아나항공,항공 여객 운송업,"항공운송업은 그 시장의 성격이 매우 상이한 여객과 화물로 나뉘어져 있음. 아시아나항공 등 항공 3사 및 국내 양대 공항공사의 시스템 구축 및 운영 노하우를 기반으로 대외 사업을 영위하고 있으며, 항공/공항IT 전문기업으로서 높은 시장 지위를 확보함. 아시아나항공은 국내여객 6개 도시, 7개 노선, 국제여객 22개 국가, 57개 도시, 62개 노선과 국제화물 12개 국가, 25개 도시, 21개 노선의 네트워크를 보유함.",7292,KOSPI
001780,알루코,1차 비철금속 제조업,"동사는 현대알루미늄,알루텍,KPTU, 알루머티리얼즈 등의 계열사로 구성된 알루코 그룹의 주력 계열사임. 알루미늄 압출품 제조dhk 판매를 주로하는 알루미늄 압출 전문 회사로서 대전공장을 보유하고 있으며, 본사와 해외법인 및 계열회사는 알루미늄 제조 관련 사업으로 수직적 사업부문을 영위하고 있음. 영업부문은 시판영업, 직판영업, 특수영업, 디스플레이·EVC영업, 건축영업으로 구성됨.",2116,KOSPI
005850,에스엘,자동차 신품 부품 제조업,"지배기업인 동사와 11개의 종속회사는 자동차 부품 전문기업임. 자동차 램프, 전동화 부품, 미러, 전자 등의 제품을 생산하여 국내외의 현대차, 기아차, GM, Ford,Geely 등의 OEM에 납품하고 있음. 국내 납품경로는 OEM 직납과 모듈업체를 통해 납품하는 두가지가 있으며 국내에서 해외로의 수출의 경우, 현지 해외법인을 거쳐 공급 하거나 수출운송을 통하여 직접 납품하고 있음.",14585,KOSPI
