종목코드,회사명,업종,기업개요,시가총액,마켓타입
010950,S-Oil,석유 정제품 제조업,"동사는 1976년 1월에 설립되고 하루 66만 9천배럴의 원유정제능력을 보유한 정유사로, 정유 뿐 아니라 석유화학 및 윤활기유 등으로 다각화된 사업을 보유. 윤활기유 부문은 고급윤활기유를 중심으로 하루 4만 4천배럴의 생산능력을 보유하고 있음. 동사의 매출액 10% 이상을 차지하는 주요 매출처는 Aramco Trading Singapore Pte. Ltd.가 있음.",63609,KOSPI
033530,SJG세종,자동차 신품 부품 제조업,"동사는 자동차용 배기계 부품을 생산 및 판매하는 사업을 주사업으로 영위. 주요 제품으로는 자동차용소음기, 배기가스정화기 및 기타 자동차부품이 있음. 주요고객은 현대/기아이며 현대자동차의 국내점유율을 기준으로 공급비중을 적용하면 약 27%의 시장점유율을 확보함. 2009년 현대, 기아의 품질5스타 최상위 등급인 그랜드 품질5스타를 현대, 기아협력사 중 최초로 인증받음.",1146,KOSPI
006120,SK디스커버리,기타 금융업,"동사는 2017년 12월 1일 투자부문을 존속법인으로 하고 사업부문을 신설법인으로 하는 인적분할을 통하여 지주회사로 전환함. 주요 자회사가 영위하는 사업부문으로는 Copolyester 수지 및 기넥신에프 등을 생산하는 친환경소재 및 제약사업(SK케미칼), LPG 등을 판매하는 LPG판매사업(SK가스)가 있음. 신재생에너지사업에는 SK이터닉스(2024년 3월 SK디앤디의 인적분할 신설법인)가 있음.",6735,KOSPI
210980,SK디앤디,부동산 임대 및 공급업,"2015년 6월에 주식을 한국거래소가 개설한 유가증권시장에 상장한 회사로서, 부동산개발 및 운영사업을 주 영업목적으로 함. 개발대상 부지 또는 물건의 확보능력, 상품 기획 능력, 성공적인 인허가 추진등 전방위적인 사업관리 능력을 바탕으로 부동산개발 및 운영사업 등을 주요사업으로 영위함. 디앤디플랫폼리츠(REITs·부동산투자회사)를 활용해 종합 부동산 플랫폼 회사로 성장하기 위해 노력 중임.",1359,KOSPI
361610,SK아이이테크놀로지,일차전지 및 이차전지 제조업,"동사는 2019년 SK이노베이션에서 물적분할 된 기업으로, LiBS(Lithium-ion Battery Separator) 제조 및 판매를 주 사업으로 영위함. 세계 최초의 5㎛ 박막 제품 개발 및 양면 동시 코팅 상업화 등 경쟁사 대비 우위의 기술력을 바탕으로 Global LiBS 시장을 선도함. LiBS의 주요 수요자는 배터리 업체이며, IT, Power tool용 소형 배터리와 xEV 및 ESS용 중대형 배터리 업체가 있음.",18716,KOSPI
285130,SK케미칼,합성고무 및 플라스틱 물질 제조업,"친환경 소재 사업을 관장하는 Green Chemicals Biz.에서는 polyester 계열의 Specialty Polymer, 접착 및 코팅제 등의 제조와 판매 사업을 전개하고 있음. 제약 바이오 사업을 관장하는 Life Science Biz.에서는 자체 개발신약, 프리미엄 백신의 제조와 판매 사업을 전개하고 있음. 자회사 SK바이오사이언스는 엔데믹용 백신 및 프리미엄 백신시장을 목표로 한 백신 포트폴리오 확장을 추진 중임.",7074,KOSPI
002900,TYM,특수 목적용 기계 제조업,"동사는 1960년 복건기업으로 설립되었으며, 1973년 상장하였음. 2021년 3월 사명을 티와이엠으로 변경함. 농기계사업 및 담배필터사업을 주요사업으로 영위하고 있으며, 동사의 종속회사가 영위하는 사업으로는 농기계제조 및 판매업이 있음. 농기계부문은 농업용 기계인 트랙터, 콤바인 등을 공급하고 있으며 트랙터가 농기계사업부 매출의 약 90% 이상을 차지하고 있음.",2187,KOSPI
037270,YG PLUS,"자료처리, 호스팅, 포털 및 기타 인터넷 정보매개 서비스업","동사는 1996년 11월 설립되었고, 국내 앨범 시장 유통 점유율 1위를 기록 중인 엔터테인먼트 인프라·지식재산권(IP) 사업 전문기업임. 주요 사업으로는 YG엔터테인먼트 등 소속 아티스트의 음반 및 음원 유통사업과 음악 플랫폼 운영대행사업, 아티스트 MD/캐릭터 제작 및 판매사업, 광고대행사업 등을 전개하고 있음. 종속회사를 통해 금융투자사업과 음반 인쇄 및 컨설팅을 영위하고 있음.",2597,KOSPI
002140,고려산업,"곡물가공품, 전분 및 전분제품 제조업","동사는 1957년 고려건설주식회사로 설립되어 1991년 유가증권시장에 상장되었으며, 금강공업 기업집단에 속해있음. 가축용 배합사료의 제조 및 판매를 주업종으로 하고 있으며, 배합사료의 안정적인 판로확보와 함께 축산물 유통 노하우 축적을 위해 식육사업부문(기타부문)을 운영함. 미국, 남미 등으로부터 옥수수, 대두박 등 제품생산에 필요한 원재료를 수입하고 있으며, 대구, 창녕 사업장에 배합사료 생산공장을 보유하고 있음.",680,KOSPI
025860,남해화학,"비료, 농약 및 살균, 살충제 제조업","동사는 비료 및 동 부산물의  생산·판매 등을 목적으로 1974년 5월에 설립되어 1995년 11월 10일 한국거래소에 상장됨. 주요 사업 부문으로는 비료 화학 사업 부문, 유류제품 사업이 있으며, 신사업으로 나노실리카 사업 및 반도체용 암모니아수 사업을 추진 중임. 2021년 반도체용 황산 전문 자회사인 ‘엔이에스(NES) 머티리얼즈’를 설립한 이후 반도체 소재 시장 진입을 추진 중에 있음.",3115,KOSPI
006280,녹십자,의약품 제조업,"동사와 연결대상 종속회사의 주요 사업은 혈액제제와 백신제제를 필두로 전문의약품, OTC제제 등의 의약품 제조 및 판매함. 사업부문 중 '의약품 등 제조 및 판매'는 혈액제제류, OTC류, 일반제제류, 백신제제, 기타로 나뉘며 '검체 등 진단 및 분석' 사업부문은 혈액 진단 및 유전자 분석을 주요 제품 및 서비스로 함. 혈액제제류의 주요 상표로는 알부민, 아이비글로블린, Advate 외가 있음.",15298,KOSPI
023590,다우기술,"자료처리, 호스팅, 포털 및 기타 인터넷 정보매개 서비스업","1986년 1월에 설립되어 소프트웨어와 시스템관련 솔루션의 개발 및 판매, 인터넷 관련 서비스 등을 주된 사업목적으로 하고 있음. IT분야로 시작하여 2000년도에 국내최초 온라인 증권사인 키움증권을 설립하였음. 국내 종속기업은 키움증권을 포함한 15개 회사이며, 해외 종속회사는 다우재팬 등 13개임. 종속회사 중 상장회사는 3개(키움증권, 한국정보인증, 와이즈버즈)임.",7941,KOSPI
019680,대교,초등 교육기관,"1986년 12월에 설립되어 학습지의 출판, 제조 및 판매를 주력 사업으로 하는 교육ㆍ문화기업으로, 1991년 01월 상호를 ㈜대교문화에서 ㈜대교로 변경하였음. 국내 최초로 개인별 능력별 1:1 학습관리를 제공하는 교육시스템을 도입한 이후 사업 영역을 확대해옴. 대표 브랜드로 '눈높이', '차이홍', '솔루니' 등이 있음. 교육서비스, 교육기관사업, 해외교육사업, 디지털교육플랫폼 개발, 학원 전문서비스업 등을 영위하고 있음.",1965,KOSPI
008060,대덕,기타 금융업,"동사 및 연결회사를 포함한 공시대상 사업부문은 PCB사업(PCB 제조 및 판매), RF사업(SAW Filter, RF module 등 제조 및 판매), 기타사업(지주사업 외)으로 구분되어 있음. 주요 자회사 및 종속회사로는 PCB 제조 및 판매업을 영위하는 대덕전자, 휴대폰에 채용되는 RF모듈을 제품 및 판해하는 와이솔 등이 있음. 동사의 주 수입원은 배당수익, 경영자문료, 대덕 브랜드 상표권 사용수익 등이 있음.",2189,KOSPI
014160,대영포장,"골판지, 종이 상자 및 종이용기 제조업","동사는 골판지 원단 및 골판지 상자 일괄 생산 판매하는 골판지 전문업체로서 업계 상위에 있으며, 또한, 3중골판지(빠렛트)시장이 수요의 증가로 인한 업계 상위를 유지하고 있음. 상자제조용 골판지원단,상자 제품 사업부문과 상자용 상품 사업부문, 폐원단 외 기타 사업부문으로 구성되어 있음. 동사는 설립 이래 골판지 및 골판지 상자를 제조, 판매하고 있으며, 2024년 1분기 기준 동사를 포함한 8개의 계열회사가 존재함.",1049,KOSPI
003220,대원제약,의약품 제조업,"동사는 의약품 제조 및 판매를 주요 사업으로 영위하는 업체이며, 신약/개량신약/제네릭의약품 등을 국내 병/의원/약국을 대상으로 공급하고 있음. 선진 GMP급 생산시설과 특화된 제품력을 기반으로 국내 유수의 제약기업의 의약품을 생산/납품하는 수탁(CMO) 사업과, 세계 시장에 완제의약품 및 의료기기 등을 수출하는 해외사업을 영위함. 국내 최초의 짜먹는 감기약 콜대원으로 대표되는 일반의약품 사업 진행 중임.",3196,KOSPI
000300,대유플러스,통신 및 방송 장비 제조업,"동사와 연결종속회사의 주요 사업은 정보통신부문, 에너지사업부문을, 자동차부품부문으로 구성되어있음. 동사 정보통신업은 KT, SK브로드밴드, LG U+와 같은 기간통신사업자와의 안정적인 매출을 기반으로 대규모 정부사업 및 공공사업에 참여. 동사의 연결대상 종속회사인 대유글로벌은 자동차 알루미늄휠을 생산하여 현대모비스, 현대자동차, 기아, 현대위아, 현대글로비스, 케이엠씨아이 등에 납품함.",1569,KOSPI
192080,더블유게임즈,소프트웨어 개발 및 공급업,"동사는 페이스북, iOS, Google 플랫폼을 통해 더블유카지노(DoubleU Casino), 더블다운카지노(DoubleDown Casino) 등의 소셜카지노 게임을 개발 및 서비스함. 더블유카지노(DoubleU Casino), 더블유빙고(DoubleU Bingo), 테이크5(Take5) 등 4가지 모바일 게임을 서비스함. 종속회사인 더블다운인터액티브는 더블다운카지노, 더블다운포트녹스, 언데드월드 등 4가지 게임을 서비스함.",10232,KOSPI
023450,동남합성,기초 화학물질 제조업,"계면활성제를 제조 ?? 판매하는 회사로 계면활성제는 세제, 섬유, 제지, 금속, 농약, 페인트, 피혁 등 전 산업에 걸쳐서 사용되고 있음. 현재 동사는 미원상사(주)를 대표로 하는 기업집단에 포함되어 있으며, 동사를 제외한 계열회사는 21개사임. 동사는 생분해성이 우수한 섬유용 유연제등 환경친화성 에너지 절약형, 환경오염의 최소화 같은 다양한 제품을 개발 하고 있음.",1087,KOSPI
026960,동서,음·식료품 및 담배 도매업,"식품사업, 포장사업, 다류사업, 수출ㆍ입 및 구매대행업 등을 주요 사업으로 영위하고 있음. 식품사업부문은 식자재 품목과 수입음료, 유지류 품목의 영업을 하고 있음. 다양한 식자재를 바탕으로 지속적으로 신제품과 프리미엄 제품을 출시하고 있음. 제조부문은 포장사업과 다류사업, 동서물산이 있으며 포장사업은 합성수지 등을 원료로 한 식품용 포장재 제조/판매, 다류사업은 다류제품 제조/판매, 동서물산은 커피제품 포장/판매를 하고 있음.",26520,KOSPI
000640,동아쏘시오홀딩스,기타 금융업,"동아제약,  용마로지스, 에스티젠바이오 등을 포함한 동아쏘시오 그룹의 지주회사로서 지주사업과 임대사업 등을 영위하며 배당금수익, 상표권사용수익, 임대수익을 통해 안정적인 수익 원천을 확보하고 있음. 종속회사들이 영위하는 사업으로는 일반의약품 및 의외약품, 바이오시밀러 및 위탁의약품, 물류, 생수, 포장용기 부문이 있음. 일반의약품 및 의외약품 품목으로는 박카스, 오쏘몰, 가그린 등이 있음.",7206,KOSPI
170900,동아에스티,의약품 제조업,"동사는 구 동아제약에서 인적분할하여 2013년 3월 1일에 설립된 신설법인으로 2013년 3월 4일에 등기되었으며, 주권은 2013년 4월 8일에 재상장 됨. 자가개발의약품, 바이오의약품, 제네릭, 도입의약품 등 다양한 제품 포트폴리오를 가지고 있으며 다수의 블록버스터 제품을 바탕으로 시장지배력을 강화함. 의료 서비스 기대치 상승에 부응하는 의약품 연구개발 활성화 등으로 인해 국내 제약산업의 계속적인 성장을 기대하고 있음.",6005,KOSPI
006040,동원산업,기타 금융업,동사는 2022년 동원엔터프라이즈와의 합병을 통해 동원그룹의 지주회사가 되었으며 배당금수입 이외에 브랜드 사용료 수취 및 용역서비스 사업을 확대함. 동사는 PS/ST 생산용 선망선과 PS 생산용 참치 선망선에서 횟감용 참치를 생산함으로써 부가가치를 증대함. 현재 18척의 국내 최대 선망선단을 운영하고 있는 동사는 주 조업지역이 중서부 태평양으로서 연간 약 20만톤 내외의 참치를 어획.,11797,KOSPI
004890,동일산업,1차 철강 제조업,"특수강봉강 및 선재는 자동차, 조선, 기계, 건설 등 전 산업에 걸쳐 산업 기초 소재로 쓰이며 국가 기간산업의 중추적인 역할을 담당하고 있는 자본, 기술 집약적인 장치 산업임. 주요 고객사는 포스코홀딩스, 현대제철, 에이치디현대인프라코어 등이며 자회사를 통해 현대위아를 고객사로 확보함. 당기말 기준 사업부문별 매출비중은 봉강 57.39%, 합금철 21.58%, 주조 10.06%, 자동차부품제조 10.96%로 구성됨.",940,KOSPI
280360,롯데웰푸드,기타 식품 제조업,"인적분할로 설립되어 2017년 10월 재상장하였으며 식품 제조, 가공, 판매 및 수입 판매업 등을 주요 사업으로 영위. 주요 제품으로는 빼빼로, 마가렛트, 꼬깔콘 등이 있으며 껌과 초콜릿 분야에서는 자일리톨, 가나와 같은 브랜드로 시장을 선도. 34개사를 종속회사로 두고 있으며 식품제조판매 회사인 Chocolaterie Guylian N.V, Lotte Kolson(Pvt.) Limited 등이 포함되어 있음.",10661,KOSPI
001080,만호제강,1차 철강 제조업,"동사는 매출액의 대부분 W/R 및 섬유로프, 특수강선의 제조 및 판매사업을 영위하고 있음. 주 생산제품인 와이어로프 및 섬유로프는 수산,조선,건설업종과, PC강선, 하이본, ACSR 등은 건설및 사회간접자본시설 확충에 사용되고 있음. 경강선, CD-BAR, 스텐레스강선 등은 자동차산업, 전자산업, 일반산업용으로 다양하게 공급함으로써 관련산업의 경기 변동에 따라 매출에 상당한 영향을 받고 있음.",1249,KOSPI
107590,미원홀딩스,기타 금융업,"동사는 미원상사로부터 인적분할 된 후 2009년 2월 2일 법인설립이 되었으며 2009년 2월 26일 유가증권시장 상장을 승인받아, 2009년 3월 2일 한국거래소 유가증권시장에 상장됨. 지주회사 체제로 전환하기 위해 2017년 인적분할 됨에 따라 투자, 용역수익, 임대수익 등의 지주회사 사업을 영위하고 있음. 2000년 동남합성 칠곡지점을 포괄영업양수하여 영업을 개시하였으며, 상품판매와 창고임대 및 보관 사업을 영위하고 있음.",1777,KOSPI
003650,미창석유공업,석유 정제품 제조업,"동사는 1962년 설립되어 산업 윤활유 전문회사로 성장하여 1989년 9월 한국증권거래소에 상장함. 동사의 주요제품은 전기절연유, 고무배합유, 윤활유등 산업용 윤활유가 주종을 이루며 제품의 고급화 및 특수유 생산에 주력하고 있음. 동사에서 생산하는 광의의 윤활유와 고무배합유, 전기절연유, 유동파라핀등의 제품은 각각 자동차 및 산업용 기계의 윤활유, 타이어 및 신발 등 고무제품의 원료 등의 원료유로서 광범위하게 사용됨.",1574,KOSPI
002410,범양건영,건물 건설업,"토목, 건축 사업을 영위하는 종합건설업체로 각 종속회사는 물류창고 임대업, 모듈러주택 제조업 및 기타사업(부동산 시행 및 개발업, 임대업)을 영위하고 있음. 토목사업은 공공부문이 주요 발주처이며, 건축사업는 공공 대비 민간에서 발주하는 사업의 규모가 큼. 동사는 토목사업의 기본적인 도로포장공사는 물론, 택지조성, 해군기지, 전력구, 화력발전소 토건, 터널 등 다양한 분야의 수주/시공 실적을 통해 축적한 기술력과 노하우를 보유함.",683,KOSPI
010140,삼성중공업,선박 및 보트 건조업,"동사는 사업 부문을 조선해양부문, 토건부문으로 구분하고 있음. 조선해양부문은 초대형컨테이너선, LNG선, 원유운반선 등 선박 및 LNG-FPSO, FPU 등 해양플랫폼을 건조, 판매하고 있으며, 토건부문은 건축 및 토목공사, 하이테크 공사를 수행하고 있음. 각 사업부문별 매출액 및 매출비중은 조선해양부문 44,654억원(91.5%), 토건부문 5,125억원(10.5%), 연결조정 981억원(-2.%)임.",102872,KOSPI
005680,삼영전자공업,전자부품 제조업,"동사는 본사인 삼영전자공업주식회사와 그 종속기업으로 구성된 동종업종을 영위하는 글로벌 전자기업임. 사업영역별로 보면 알루미늄 전해콘덴서 및 고체콘덴서를 생산ㆍ판매하는 콘덴서 제품사업과 콘덴서 자재를 생산ㆍ판매하는 콘덴서 자재사업으로 구성되어 있음. 전해콘덴서 제품군은 생활가전, 전장, 5G, 의료기기, SSD등 적용되며 고체콘덴서 제품군은 전장, TV모니터, 소형화 가전 등에 적용됨.",2016,KOSPI
000520,삼일제약,의약품 제조업,"동사는 1947년 설립된 의약품 제조 및 판매하는 제약회사로 어린이부루펜시럽, 티어실원스, 아이투오미니 등으로 잘 알려진 중견 제약회사임. 안과, 간질환, 소화기계에 특화된 전문의약품 중심으로 오리지널 품목의 기술도입·생산 및 특허가 만료된 제네릭 제품을 직접 생산 판매하는 제품 매출이 있음. 오리지널 제품을 직수입 및 국내 독점 판매하는 상품 매출 또한 사업두조 중 하나임.",2789,KOSPI
010960,삼호개발,기반조성 및 시설물 축조관련 전문공사업,"전문건설업체로서 도로공사, 지하철공사, 항만시설공사, 간척지공사, 택지 및 산업단지조성공사 등의 국내외 주요토목공사 시공에 참여함. 종속회사로는 삼호그린인베스트먼트, SGI-신성장메짜닌펀드, SGI-세컨더리 투자조합 제2호가 있음. 고속도로 및 국도 등의 도로공사, 골프장조성공사, 지하철공사, 항만시설공사, 간척지공사, 택지 및 산업단지조성공사 등의 토목공사를 하고 있음.",771,KOSPI
004450,삼화왕관,기타 금속 가공제품 제조업,"동사는 병마개 제조 및 판매업과 금속인쇄 및 제관업, 합성수지제품 제조 및 판매업 등을 영위할 목적으로 1965년 설립됨. 동사는 병마개만을 제조해 온 전문 병마개 제조업체임. 비금속과 금속캡을 제조해 국내의 음료 업체 뿐 아니라, 세계 10여개국에 수출하고 있음. 국세청 지정병마개 제조자 지정업체로서 거래처가 원하는 물량을 적기에 공급하고 충실한 A/S지원과 품질향상을 통해 최고 품질의 병마개를 제조판매하고 있음.",658,KOSPI
001290,상상인증권,금융 지원 서비스업,"1954년 대유증권주식회사로 설립되었으며, 2019년 3월에 상상인으로 대주주 변경됨. 이후 골든브릿지증권에서 상상인증권으로 상호를 변경함. 유가증권의 위탁매매업무, 인수/주선 업무, 자기매매업무 및 이를 바탕으로 얻은 자금을 운용하여 수익을 창출함. IB부문은 우수 영업인력 영입과 육성 등 영업조직 강화를 통해 성장동력을 갖추었으며, 지속적인 리스크관리 등으로 성과를 보이고 있음.",459,KOSPI
007540,샘표,기타 금융업,"동사는 자회사 관리 및투자를 목적으로하는 지주회사 부문과 식품 제조 및 판매를 목적으로하는 식품사업 부문으로 영업부문을 구분하여 운영하고 있음. 지주사업 부문은 샘표 주식회사, 식품사업 부문은 샘표식품(주), 양포식품(주), (주)샘표아이에스피, 조치원식품(주)의 회사가 있음. 지주사업 부문인 샘표 주식회사는 지분법 수익, 배당 수익, 임대 수익, 브랜드 수익 등의 수익이 있음.",1237,KOSPI
200880,서연이화,자동차 신품 부품 제조업,"2014년 7월 1일을 분할기준일로 서연으로부터 인적분할 방식으로 설립되었으며 2014년 유가증권시장에 주권을 상장함. 동사는 자동차 부품(승용차 내외장품 및 상용차 SEAT) 전문생산업체로서 자동차 산업발전에 일익을 담당하고 있으며, 생산부품의 상당량을 현대자동차 및 기아에 공급하고 있음. 동사는 열폭주방지 구조의 전기차용 배터리 모듈’ 특허를 보유하고 있음.",3343,KOSPI
007610,선도전기,"전동기, 발전기 및 전기 변환 · 공급 · 제어 장치 제조업","지배회사인 동사는 중전기기 전문업체로 발전, 송변전, 배전설비등 제반 산업용 플랜트의 전력설비에 공급되는 각종 전력변환기기류를 생산 및 판매하는 사업부문을 보유함. 종속회사인 SD벤처캐피탈은 창업자 및 벤처기업에 금융투자하는 사업부문으로 구성된 기업임. 에스디파트너스는 자본시장법상 허용되는 다른 회사 등의 주식 또는 지분 등에 투자, 주식 및 지분 취득에 관한 자문, 금융투자에 관한 컨설팅을 하는 기업임.",540,KOSPI
002420,세기상사,연료 소매업,"동사는 1958년 8월 21일에 설립되었으며, 1968년 12월 24일자로 유가증권시장에 상장됨. 석유판매사업부는 2021년 4월  신설됐으며, 현재 총 8개소의 주유소를 운영 중이며, 극장사업부는 2001년 12월말에 신축준공된 대한극장을 보유하고 있음. 문화레저사업부는 2021년 8월 신설돼 현재 부산 해운대구 해변로에 스누피 플레이스 1호점을 운영하고 있음.",322,KOSPI
021820,세원정공,자동차 신품 부품 제조업,"동사는 자동차부품 전문생산업체로 현대자동차 및 현대계열회사의 여러 차종에 대한 부품개발 참여 및 양산 납품을 하고 있음. 주요 생산품목은 FRONT SIDE MEMBER, COWL CROSS MEMBER, DASH PANEL, RADIATOR SUPPORT 등의 차체제품이 있음. 자동차 차체부품이 매출의 100%이며, 주요판매처로 현대자동차, 현대모비스, 북경현대, 북경모비스, 덕양산업, 기아 등이 있음.",691,KOSPI
026890,스틱인베스트먼트,신탁업 및 집합투자업,"사모펀드(PEF) 운용사 최초로 유가증권시장에 상장하였으며, 2021년 12월 17일 합병을 통해 상호를 변경하였음. 변경전 상호는 '디피씨주식회사'임. 동사는 사모투자 사업을 영위하는 회사로서, 자본시장과 금융투자업에 관한 법률에 의거 금융감독원에 등록된 기관전용 사모집합투자기구 운용회사임. 사모펀드 및 벤처투자 운용사의 주된 수입원은 관리보수와 성과보수, 그리고 자기자본 투자수익으로 이루어져 있음.",3101,KOSPI
002700,신일전자,기계장비 및 관련 물품 도매업,"동사는 1959년 설립되어 종합가전 생산 및 판매업을 주요사업으로 함. 동사는 하이마트, 이마트, 홈플러스, 농협하나로 마트 등 대부분의 대형 유통할인점에 납품이 이루어지고 있으며 지역 소재 대리점은 동사와 오랫동안 거래하고 있는 대리점임. 2023년도 연간 기준으로 대리점이 66%, 홈쇼핑 11%, 할인양판점이 약 23%를 차지하고 있으며, 2024년 1분기 기준으로 선풍기의 매출비중이 54.7% 정도 차지함.",1059,KOSPI
002870,신풍,기타 전문 도매업,"1960년에 설립된 동사는 지류 유통 판매업을 주된 사업으로 영위하고 있음. 연결 종속회사는 에스피모터스(수입자동차 판매), 꿈의실현1331(학원업),다웅(수입오디오,필터 수입 및 판매업)으로 총 3개사로 이루어짐. 신규사업으로 M&A를 지속적으로 검토 중임. 평택공장 부지가 한국토지주택공사에 수용돼 2019년 12월 말 부로 평택공장에서 조업을 중단함에 따라 2020년 1월부터 지류 유통업으로 업종을 변경함.",300,KOSPI
404990,신한서부티엔디리츠,부동산 임대 및 공급업,정보 없음,1886,KOSPI
