종목코드,회사명,업종,기업개요,시가총액,마켓타입
003540,대신증권,금융 지원 서비스업,"금융투자업을 주요 사업으로 영위하고 있으며, 연결대상 종속회사는 대신에프앤아이, 대신저축은행, 대신자산운용, 대신경제연구소, 대신프라이빗에쿼티, 대신자산신탁, 카사, 해외현지법인 등이 있음. 영업전략의 다변화를 통해 자산관리 컨설팅 강화, 해외업무 확대, 부동산 및 PF 구조화증권 관련 IB 업무 등을 강화하고 있음. 2019년 부동산신탁회사인 대신자산신탁을 설립했으며, 2023년 부동산디지털수익증권거래소 카사를 인수함.",8312,KOSPI
000430,대원강업,자동차 신품 부품 제조업,"동사는 1946년 9월 20일에 설립되었으며 차량용/산업용 스프링과 차량용 시트 제작/판매를 사업 목적으로 하고 있음. 국내 유일의 종합 스프링 메이커인 동사는 스프링 일괄 생산 체제를 갖추고 생산성 향상, 원가 절감 및 관련 기술의 연구에 주력하고 있음. 현재 동남아시아, 인도, 중국 및 유럽 등 여러 회사와 스프링 제조기술 이전에 관한 기술 제휴 계약을 체결하고 있음.",2353,KOSPI
012800,대창,1차 비철금속 제조업,"동사의 주요 제품은 황동 봉 및 동합금 제품이며 주요 생산품인 황동봉은 반도체, 전기, 전자부품, 자동차, 선박, 산업용 기계류 등 첨단 기초소재로써 활용됨. 황동봉 이외에도 황동 관련 일부 상품 및 기타 품목을 매출하고 있음. 내수시장에서 확고한 기반을 다졌으며 아시아 최대 황동봉 수출업체로서 동남아, 호주, 뉴질랜드, 미국, 유럽, 인도 등 약 20여 개국에 수출을 하고 있음.",1084,KOSPI
005960,동부건설,토목 건설업,"동사는 사업부문 구분의 계속성 등을 고려하여 건설부문, 기타부문으로 사업을 구분하고 있음. 지배회사인 동사의 주요제품 및 서비스는 국내도급공사(건축, 토목, 플랜트)와 기타부대사업으로 구분되며 지배회사인 동부건설에서 사용하는 주요 원재료는 건설시공에 사용하는 철근과 레미콘 등의 건설자재임. 종속회사의 주요 제품 및 서비스는 설계, 감리(동부엔지니어링㈜), 부동산업(㈜더파크,㈜필우산업개발, 와이제이글로벌개발㈜) 등이 있음.",887,KOSPI
049770,동원F&B,기타 식품 제조업,"2000년 11월  동원산업(주)으로부터 분할하여 설립되어 2000년 11월 한국거래소에 상장하였으며, 식품의 제조 및 판매를 주요사업으로 영위하고 있음. 동사의 사업부문은 일반식품부문, 조미유통부문, 사료부문, 온라인사업부문으로 구성되어 있음. 일반식품은 동원 브랜드의 참치캔 등, 양반 브랜드의 조미김 등, 덴마크 등 유가공제품, 리챔의 육가공제품, 다양한 소스류와 사료사업 등으로 확장해왔음.",5972,KOSPI
336260,두산퓨얼셀,"전동기, 발전기 및 전기 변환 · 공급 · 제어 장치 제조업","동사의 핵심 사업은 발전용 연료전지 사업으로, 발전용 연료전지 기자재 공급 및 연료전지 발전소에 대한 장기유지보수서비스 제공을 주요 사업으로 영위함. 발전용 연료전지 및 기자재 공급, 발전소에 대한 장기유지보수서비스 제공을 주요 사업으로 하고 있으며 주요 고객사는 공공 및 민간 발전사업자임. 미래성장을 위하여 익산공장 PAFC 생산시설 증설에 착수하였고, 차세대 SOFC 시스템 개발 및 생산설비 구축을 진행.",10368,KOSPI
377190,디앤디플랫폼리츠,부동산 임대 및 공급업,정보 없음,1806,KOSPI
027740,마니커,"도축, 육류 가공 및 저장 처리업","육계계열화 업체로서, 계육 제품을 생산하여 판매하는 사업을 영위하며, 1985년 9월 27일 설립되었음. 계육제품의 생산 및 판매 사업을 주요 사업으로 하고 있는 수직 계열화 업체로, 육계계열화 사업은 종계사업, 부화사업, 사육사업, 도계ㆍ육가공사업, 유통사업의 각단계별 사업부문을 일괄하고 있음. 육계계열화 사업은 종계사업, 부화사업, 사육사업, 도계ㆍ육가공사업, 유통사업의 각단계별 사업부문을 일괄하는 통합경영 시스템임.",548,KOSPI
118000,메타케어,기계장비 및 관련 물품 도매업,"동사는 의료기기, 의료용품 등의 메디컬 부문과 의약품 부문의 사업을 영위함. 메디컬사업부문은 정형외과 병원에 최적화된 공급시스템을 확보하여 직접적인 의료행위 이외에 인공고관절, 인공슬관절 등, 병의원 전반에 필요한 의료소모품을 제공하는 의료MRO 전문 회사로써 인공관절을 주로 납품하고 있음. 2024년 8월 5일 임시주주총회에서 정관변경을 통해 기존 사명인 에스메디에서 메타케어로 이름 변경.",531,KOSPI
012690,모나리자,기타 종이 및 판지 제품 제조업,"동사는 화장지 제조와 판매 등을 영위할 목적으로 1977년 10월 설립되었음. 회사의 목적 사업으로는  화장지 제조 판매업, 지류 제조 판매업, 의약외품 제조 판매업, 일용잡화 판매업, 무역업, 기계류 제작판매업 등이 있음. 동사는 2024년 06월 30일 작성기준일 현재 지주회사인 엠에스에스홀딩스(주)의 계열회사이며, 당사를 포함한 총 8개의 관계회사가 있음.",1068,KOSPI
033920,무학,알코올음료 제조업,"동사는 부산, 경남, 울산을 대표하는 주류제조 및 판매 기업으로 동남권 지역에서 주력상품인 순한 소주 '딱좋은데이' 및 '화이트소주'로 소주시장에서 주요 위치를 차지하고 있음. 지역밀착 경영을 통한 높은 점유율을 유지관리하고 있으며, 매실마을, 국화면좋으리와 같이 지역 특산물을 이용한 주류의 개발과 상품화로 지역과의 동반성장을 위해 노력함. 미국과 일본 등지에서 꾸준한 수출 실적 상승으로 이어가고 있음.",1727,KOSPI
268280,미원에스씨,기초 화학물질 제조업,"동사는 UV경화에 사용되는 핵심 원료인 아크릴계 제품 및 광개시제를 생산, 판매함.  PVC상재용, 목공용 시장의 기반 위에서 출발한 이후 잉크분야 및 각종 필름 코팅 사업을 하고 있음. 동사에서 생산된 주요 제품은 공장,사무소 및 중간 도매상등의 경로를 통해 국내외로 판매되고 있음. UV경화사업은 지속적으로 확대되어 고부가가치 미래신산업부문까지 적용범위가 늘어날 것으로 기대됨.",6710,KOSPI
000890,보해양조,알코올음료 제조업,"동사는 소주, 과실주, 리큐르, 탁주, 일반증류주, 위스키, 식음료의 제조 및 판매를 주된 영업으로 하고 있음. 소주 부문은 잎새주, 보해소주, 보해골드, 저도수 소주 등 다양한 브랜드를 운영하여 소비시장의 다양성에 대응하고 있음. 2021년 7월에는 보해가 2년간의 준비과정을 통해 새로운 소주 레시피 기준과 제품력 기반 브랜드 설계를 통해 신제품  '보해소주' 를 출시함.",587,KOSPI
003000,부광약품,의약품 제조업,"1960년 설립된 의약품, 의약외품 제조업 및 판매업과 연구개발 등 생명공학 관련사업을 영위하는 회사로 1988년 유가증권시장에 상장됨. 주요 제품으로는 레가론, 치옥타시드, 훼로바, 덱시드, 씬지로이드, 아프로벨, 오르필, 액시마, 헥사메딘, 등이 있음. 동사는 전국을 대상으로 영업활동을 하고 있으며, 매출형태별로는 제품매출, 상품매출, 수출/기타 매출이 있음.",3046,KOSPI
002070,비비안,봉제의복 제조업,"동사는 1957년 설립된 언더웨어 및 이너웨어 전문 기업임. 여성용 파운데이션, 란제리, 스타킹, 마스크 등이 주요 품목임. 비비안, 바바라, BBM, 마터니티, 젠토프, 수비비안, 드로르, 로즈버드, 판도라 등의 다양한 브랜드를 생산하고 있으며, 주요 매출 품목으로는 여성용 파운데이션, 란제리, 스타킹 및 마스크 등을 생산하고 있음. 브랜드 특성에 맞는 타켓층을 선별, 그에 적합한 제품을 다양화하고 있음.",231,KOSPI
100220,비상교육,"서적, 잡지 및 기타 인쇄물 출판업","동사는 1997년 설립되어 현재 3개의 계열회사 및 2개의 관계회사를 통하여 출판 및 교육서비스 사업을 영위하고 있음. 동사의 사업분야는 출판 부문, 러닝 부문, 티칭 부문, 기타 부문 등으로 나뉘며, 국내외의 유아에서 고등까지 학령인구를 주 대상으로 함. 교과서 및 교재의 상당부분을 연말~연초에 주문하는 출판사업의 특성상, 매출의 상당부분이 4/4분기와 1/4분기에 걸쳐 발생하는 특성이 있음.",758,KOSPI
014710,사조씨푸드,수산물 가공 및 저장 처리업,"동사는 1980년 3월 사조냉장으로 설립되어 수산물 도소매업을 시작으로 현재는 참치 어획에서부터 가공, 유통, 수출, 부가식품 개발 및 판매를 책임지는 수산물 가공유통전문기업으로 성장함. 횟감용 참치의 가공 및 유통사업은 국내 원양업체들이 태평양, 인도양 등에서 어획한 참치를 절단, 가공하여 국내외 소비자들에게 유통하는 사업임. 동사의 원양어업은 연승과 선망으로 구분됨.",871,KOSPI
448730,삼성FN리츠,부동산 임대 및 공급업,정보 없음,4161,KOSPI
018260,삼성에스디에스,"컴퓨터 프로그래밍, 시스템 통합 및 관리업","1985년 5월 1일에 설립되었음. 주 사업은 IT서비스와 물류 2개 사업부문으로 구성되어 있으며, IT서비스는 크게 비즈니스 솔루션과 클라우드&ITO 서비스로 구분됨. 클라우드 서비스는 기업 고객에게 클라우드 도입 컨설팅부터 마이그레이션, 효율적인 통합 운영까지 End-to-End IT 서비스를 클라우드 위에서 제공하고 있음. 동사는 삼성 관계사의 IT 경쟁력을 지속 강화하는 한편, 대외 시장 확대에도 역량을 집중하고 있음.",114751,KOSPI
001360,삼성제약,의약품 제조업,"동사는 의약품 제조 및 판매업, 바이오사업, 건강식품 제조 및 판매업을 영위하고 있음.의약품과 건강식품을 생산하는 제약회사임. 주요제품으로는 까스명수, 쓸기담, 우황청심원현탁액, 판토에이등이 있으며, 노인성 질환 전문의약품 강화를 목적으로 신제품 발매 및 허가를 진행하고 있음. 전문의약품의 경우 항생제. 전립선치료제 등 80여개의 다양한 제품군을 바탕으로 판매대행을 활용한 마케팅 및 영업활동을 진행함.",1426,KOSPI
000810,삼성화재해상보험,보험업,"국내에서 가장 규모가 큰 삼성계열의 손해보험사로, 손해보험업과 제3보험업을 핵심사업으로 영위하고 있음. 회사가 제공하는 상품의 보종별 보험수익 비중은 일반보험 14.0%, 장기보험 51.3%, 자동차보험 34.7%이며, 국내 3개, 해외 6개의 연결대상 자회사가 있음. 삼성화재 중국법인에 대한 중국금융감독당국의 최종승인을 득함. 중국 최대 IT기업인 텐센트와 협력하여 중국법인을 합작법인 형태로 전환할 예정임.",174813,KOSPI
003230,삼양식품,기타 식품 제조업,"동사는 1961년 유지공업과 식품도매업을 영위하기 위하여 설립되었으며, 면류, 스낵류, 유제품, 조미소재류 등을 제조하여 판매하고 있음. 국내 최초의 원조라면 삼양라면을 포함한 불닭볶음면, 볶음짜짜로니, 간짬뽕, 나가사끼짬뽕, 쇠고기면, 맛있는라면, 짱구, 사또밥 등 다양한 식품을 생산 판매함. 웰빙트렌드에 맞춰 소비자 건강에 대한 욕구를 충족시키기 위해 우수한 품질의 신제품을 개발함.",40980,KOSPI
002170,삼양통상,"가죽, 가방 및 유사제품 제조업","동사는 원피를 수입, 가공해 피혁원단을 생산한 뒤 국내외에 판매하는 것을 주요 사업으로 하며 가죽 사업 부문이 전체 매출의 98.7%를 차지함. 부수적으로 연결회사를 통해 서울, 경기와 부산 등에서 부동산임대업을 영위하며 임대 사업은 매출의 1% 가량을 차지함. 카시트용 가죽부문은 중국 청도 현지법인을 통하여 차별화된 기술력을 통해 고객의 신뢰를 구축하고 있음.",1496,KOSPI
002810,삼영무역,기타 전문 도매업,"1959년 10월 설립된 동사는 자동차부품 및 화공약품 판매사업과 관계사인 케미그라스에서 생산한 플라스틱렌즈를 수출하는 안경렌즈 사업을 영위. 화공약품 판매업은 창립이래 50여년간의 영업 노하우를 바탕으로 안정적인 공급망과 다양한 취급상품 및 판매처를 확보하여 업계 선두 위치를 고수하고 있음. 자동차부품사업은 라디에이터그릴, 엠블럼/레터링, 휠캡 등을 사출/도금/도장/조립 공정을 통해 완성차 및 1차벤더 업체로 납품하는 형태임.",2355,KOSPI
004440,삼일씨엔에스,"시멘트, 석회, 플라스터 및 그 제품 제조업","동사는 1965년 12월에 설립되어 용인공장, 칠서공장, 충주공장, 부여공장, 군산공장에서 고강도 콘크리트 파일의 생산 및 판매, 철구조물 제작설치를 주사업목적으로 함. 동사의 주요 사업은 크게 콘크리트부문과 스틸사업부문으로 나뉨. 동사의 매출은 내수 위주로 이루어져 있으며, 콘크리트사업부의 경우 외부신용평가기관의 최근 신용평가보고서와 내부 채권관리기준에 따라 현금 또는 어음 결제조건으로 납품 판매가 이뤄짐.",474,KOSPI
003080,성보화학,"비료, 농약 및 살균, 살충제 제조업","동사는 1961년 설립되어 작물보호제 제조 및 판매사업을 영위하고 있으며, 1976년 유가증권시장에 상장되었음. 작물보호제는 살충제, 살충살균제, 제초제, 살균제 등으로 세분화되며, 농민 대상의 도소매 위주이므로 춘·하절기에 매출이 집중되는 계절적 특수성을 가지고 있음. 농수산물 수입 개방과 작물보호제 원제 수입자유화 조치로 인하여 어려움이 상존하고 있으나, 품질개선과 신제품 개발 등으로 대외 경쟁력 강화에 힘쓰고 있음.",506,KOSPI
068270,셀트리온,기초 의약물질 제조업,"동사는 생명공학기술 및 동물세포대량배양기술을 기반으로 항암제 등 각종 단백질 치료제(therapeutic proteins)를 개발, 생산하는 것을 목적사업으로 하고 있음. 아시아 최대인 140,000L 규모의 동물세포배양 단백질의약품 생산설비를 보유하고 있으며 향후 개발 일정과 수요 등을 고려하여 3공장 신설 예정. 세계 최초 개발한 자가면역질환 치료용 바이오시밀러 ‘램시마’는 2016년 미국 FDA로 부터 판매 승인 받음.",374678,KOSPI
336370,솔루스첨단소재,전자부품 제조업,"동사는 두산 전자BG에서 인적분할되어 2020년 12월 솔루스첨단소재로 상호명을 변경하였음. 전지박 사업부문(전지박, 동박)은 해외자회사를 통해 개발, 제조 및 판매 사업 영위 중임. 첨단소재 사업부문(전자소재)는 OLDE 소재의 개발, 제조 및 판매 사업 영위 중. 주요 제품 및 서비스로는 PCB, 통신장비, 전기차 배터리 용도로 쓰이는 동박/전지박, Display용 소재에 활용되는 OLED제품군 등임.",6481,KOSPI
248070,솔루엠,전자부품 제조업,"동사는 전자기기 부품의 연구개발 및 제조를 주요 사업으로 영위함. 사업부문은 크게 2개로 구성되는데, 파워모듈, 3IN1보드 등을 생산/판매하는 전자부품 사업부문과 ESL, IoT 등을 생산/판매하는 ICT 사업부문으로 구성됨. 본사에서 보유하고 있는 개발기술 및 지적재산권을 기반으로 하여 중국, 베트남, 멕시코, 인도 등 해외에 종속회사를 두고 각종 전자부품의 생산/판매를 하고 있음.",8856,KOSPI
005390,신성통상,기타 전문 도매업,"동사는 1968년 설립된 이후 니트의류 수출기업으로서 주문자상표부착(OEM)방식의 수출을 통해 성장하였음. 현재 Target, WalMart 등 대형 Buyer 위주로 영업을 전개하고 동사의 핵심 생산기지인 Nicaragua 중남미 현지법인과 더불어 Indonesia 에 소재한 현지법인에 대규모 신·증설을 추진함. OLZEN, ZIOZIA, ANDZ, EDITION ANDZ, TOPTEN10 브랜드를 영위함.",3032,KOSPI
005800,신영와코루,봉제의복 제조업,"동사는 여성내의류를 전문으로 생산, 판매하고 있으며 제품 매출의 대표 브랜드는 비너스, 와코루, 솔브, 마더피아, 자스민, 아르보, 리맘마, 트레노, 아네타 등이 있음. 또한, 여성스타킹 등의 상품을 판매하고 있으며 그 밖에 임대수익이 있음. 회사의 대표적인 브랜드라 할 수 있는 비너스는 1999년 부터 2024년에 걸쳐 한국능률협회가 선정하는 브랜드파워(K-BPI) 부문에서 26년 연속 브랜드파워1위 수상.",811,KOSPI
009270,신원,봉제의복 제조업,"동사는 KNIT, SWEATER를 OEM/ODM 생산하여 수출하는 수출부문과 패션 브랜드 사업을 전개하는 패션부문을 보유. GAP, WAL-MART, TARGET 등 약 10여개 고정바이어를 확보함. 이탈리아 럭셔리 브랜드 까날리(CANALI)와 스트리트 럭셔리 캐주얼 GCDS와 국내 독점 유통 및 영업권을 획득하여, 2024년 상반기부터 사업을 전개할 예정.",1243,KOSPI
293940,신한알파리츠,부동산 임대 및 공급업,정보 없음,6628,KOSPI
004080,신흥,기계장비 및 관련 물품 도매업,"동사는 치과용기자재의 제조 및 도소매를 목적으로 1964년 11월 13일에 설립되었으며, 1991년 유가증권시장에 상장함. 치과의료기기 제조 및 유통 전문업체로써 주요 제품은 치과용진료대, 치과용합금, 치과용 X선촬영기, 공기압축기 등이 있음. 전국 지점,유통,A/S망과 제조공장, 물류센터 등을 갖추고 효율적인 경영활동과 고객 서비스 제공이 될 수 있도록 사업을 전개함.",1356,KOSPI
004770,써니전자,전자부품 제조업,"동사는 기초 소자인 수정 단결정 특유의 압전 효과를 이용, 주파수를 발생시키거나 특정 주파수 대역의 신호만을 걸러주는 필터 역할을 하는 수정진동자 및 응용제품 등 정밀공업용제품을 제조/판매하고 있음. 수정진동자의 경우 주요 고객은 삼성전자, 엘지전자 등 국내 주요 세트업체임. 연결회사의 사업부문은 수정진동자사업부문 단일의 사업부문으로 사모투자신탁 2개사는 금융투자업을 영위(사모 펀드)하고 있음.",584,KOSPI
008700,아남전자,영상 및 음향기기 제조업,"동사는 홈오디오 제품인 AV 서라운드 리시버, 스트레오 리시버, BT Speaker, Wifi 및 에이아이 스피커, AI Soundbar를 개발, 생산 및 판매함. 또한 ATMOS 사운드바, OTT Soundbar  등을 개발, 생산 및 판매함. 오디오 사업부문 이외에 신규사업으로 피트니스 부품(전자기판 등), 전자악기 부품(음향조절기기 등) 비지니스를 시작하였고, 부품 판매, 부동산 임대사업을 영위하고 있음.",895,KOSPI
002790,아모레퍼시픽그룹,기타 화학제품 제조업,"동사의 주요 종속회사는 아모레퍼시픽, 이니스프리, 에뛰드, 아모스프로페셔널, 에스쁘아, 오설록, 농업회사법인 오설록농장, 코스비전 등이 있음. 프리미엄 시장에서 ‘마몽드’는 플라워 스토리를 체험할 수 있는 플래그십 스토어 오픈을 통하여 고객에게 차별화된 브랜드 경험을 제공하고 있음. 생활용품부문의 오랄 카테고리에서 자연주의 덴탈케어 브랜드 ‘플레시아’를 출시하여 고객 저변을 확대하고있음.",18512,KOSPI
012170,아센디오,"영화, 비디오물, 방송프로그램 제작 및 배급업","동사는 1977년에 설립되어 현재 영화의 투자ㆍ제작ㆍ배급, 드라마 기획개발ㆍ제작 등을 영위하는 종합 엔터테이먼트 회사임. 과거 주력사업이던 영화 외에도 드라마, 예능, 공연, 전시 등 상호간 시너지를발생 시킬 수 있는 사업 진행을 통해 선순환 사업구조를 구축하였음. 동사의 다른 산업인 매니지먼트사업부문은 2024.03.31 소속배우 계약해지로 사업을 중단하였음.",425,KOSPI
010780,아이에스동서,"시멘트, 석회, 플라스터 및 그 제품 제조업","동사 및 종속회사는 콘크리트사업부문, 건설사업부문, 환경사업부문, 기타사업부문으로 구성되어 있음. 주요 사업인 콘크리트사업부문은 PHC PILE, Ext PILE 외 건축자재를 생산 ·판매하며, 건설사업부문은 건축, 토목공사를 바탕으로 아파트 및 상가를 공급하고 있음. 또한 환경사업부문은 폐자원, 골재판매, 폐기물 처리용역, 환경설비건설 및 폐배터리 재활용 등의 사업을 영위함.",5663,KOSPI
181710,엔에이치엔,소프트웨어 개발 및 공급업,"2013년 8월 네이버의 게임사업 부문을 인적분할하여 설립되었으며, 현재 온라인 및 모바일게임 사업과 간편결제 서비스 및 웹툰 서비스 등을 운영하고 있음. 동사는 크루세이더퀘스트, 킹덤스토리 등의 RPG 등 다양한 장르의 게임을 통해, 다변화된 모바일게임을 선호하는 이용자들의 기대에 부응하고 있음. 매출구성은 결제및광고 약 48.53%, 기타 약 32.12%, 게임 약 19.35%로 이루어져 있음.",5727,KOSPI
111770,영원무역,상품 종합 도매업,"2009년 7월 영원무역홀딩스와 인적분할을 통해 설립되었음. 약 40여개의 해외 유명 아웃도어 및 스포츠 브랜드 바이어들로부터 주문을 받아 OEM 방식으로 생산하여 수출함. 아웃도어, 스포츠의류, 신발, Backpack, 특수기능 원단 등을 생산·수출하는 제조OEM 사업, 프리미엄 자전거와 스포츠용품을 유통하는 SCOTT 사업, 아웃도어 브랜드 제품을 유통하는 기타 사업부문으로 운영됨.",17414,KOSPI
012160,영흥,1차 철강 제조업,"동사는 와이어로프, 와이어, PC강연선등과 같은 선재 2차 제품을 생산 및 판매하는 철강사업부문과 자동차용 스프링 등을 제조, 판매하는 자동차부품사업부문이 있음. 운송 및 하역서비스를 제공하는 물류사업부문, 철강등 금속물의 방청 방습 포장재를 제조하는 포장재사업부문, 냉간압조용선재(CHQ Wire) 및 STEEL BAR를 제조, 판매하는 냉간선재사업부문을 보유함. 미국, 일본, 중국에 철강선을 유통하고 있음.",415,KOSPI
015360,예스코홀딩스,회사 본부 및 경영 컨설팅 서비스업,"동사는 1981년 도시가스사업을 목적으로 설립되어 2018년 물적분할로 도시가스사업부문을 분할, 예스코를 신설하고 존속회사 예스코홀딩스를 지주회사로 전환함. 연결대상 종속회사들이 영위하는 사업은 지주 및 투자부문, 도시가스, 기타부문으로 크게 3가지 영역이 있음. 동사는 한성피씨건설 매각을 결정했으며, 거래종결 예정일은 2024년 9월 6일이며 거래 종결시 한성피씨건설은 연결대상회사에서 제외될 예정.",2994,KOSPI
017370,우신시스템,특수 목적용 기계 제조업,"동사는 자동차 차체 자동용접 라인 설비에 대한 제조 및 판매, 차체 부품사업 등을 영위하는 자동차 차체 설비에 대한 Total Engineering 업체임. 매출 중 해외 비중이 80% 내외를 차지하고 있으며, 국내 차체자동용접 설비 시장에서는 20% 내외의 시장점유율 갖고 있는 것으로 추정. 동사 자동차부품부문의 안정적 성장으로 해당 부문의 매출 비중은 지속적으로 높아지고 있음.",1326,KOSPI
095720,웅진씽크빅,초등 교육기관,"동사 및 종속회사는 출판 및 교육서비스 사업을 영위하고 있으며, 그 외에 도서 물류 및 유통 사업, 통합형 학원 관리 플랫폼사업 등을 영위하고 있음. 사업부문은 교육문화사업본부, 미래교육사업본부, 기타사업부문, 도서유통 및 물류사업, 영어 교육사업, 모바일 플랫폼사업, 기타로 구분됨. 교육문화사업부의 스마트학습은 종이 학습지와 디지털 콘텐츠를 결합하여 다양한 관리 서비스를 패키지로 묶은 태블릿 기반의 학습지 등이 있음.",1924,KOSPI
000700,유수홀딩스,회사 본부 및 경영 컨설팅 서비스업,"동사는 1949년 설립되었으며, 2014년 '한진해운홀딩스'에서 '유수홀딩스'로 사명 변경함. 자회사의 주식을 확보, 유지, 관리하는 등 실질적인 지주회사의 역할을 하고 있으며, 주된 영업수익은 임대사업수익, 자회사의 배당수익 등으로 구성되어 있음. 연결대상 종속회사로는 싸이버로지텍(소프트웨어 개발 및 판매), 유수로지스틱스(화물운송 중개, 대리 및 관련 서비스업) 등이 있음.",1323,KOSPI
